topic_slug	topic_title	cluster_slug	cluster_title	keywords
payments	Payments	fees	Payment Fees	fee fees interchange markup pricing
payments	Payments	chargebacks	Chargebacks & Disputes	chargeback dispute reversal refund
payments	Payments	fraud	Payment Fraud & Risk	fraud risk pci compliance
payments	Payments	settlement	Instant Settlement	settlement instant payout ach
ai-automation	AI Automation	call-agents	AI Call Agents	call agent phone answering
ai-automation	AI Automation	sms	AI Texting & Replies	sms text reply follow-up
ai-automation	AI Automation	reviews	AI Review Reply Systems	review replies google yelp
ai-automation	AI Automation	workflows	AI Workflows & Automations	zapier make workflow automation
small-business-tech	Small Business Tech	crm	CRM & Customer Systems	crm hubspot pipeline leads
small-business-tech	Small Business Tech	sops	SOPs & Process Systems	sop process checklist workflow
small-business-tech	Small Business Tech	analytics	Analytics & Tracking	conversion tracking google ads
prediction-markets	Prediction Markets	kalshi	Kalshi	kalshi order fill spread probability
prediction-markets	Prediction Markets	hedging	Hedging Systems	hedge hedging in-game first quarter
prediction-markets	Prediction Markets	structure	Structured Betting Lab	signal log performance roi
